afafa82@DESKTOP-IHBR4H5:~$ sudo tcpdump -i eth0
tcpdump: verbose output suppressed, use -v or -vv for full protocol decode
listening on eth0, link-type EN10MB (Ethernet), capture size 262144 bytes
03:21:08.691821 IP DESKTOP-IHBR4H5.51457 > 239.255.255.250.1900: UDP, length 101
03:21:08.701377 IP 172.20.3.150.46166 > DESKTOP-IHBR4H5.domain: 13616+ PTR? 250.255.255.239.in-addr.arpa. (46)
03:21:08.707644 IP DESKTOP-IHBR4H5.mdns > 224.0.0.251.mdns: 0 PTR (QM)? 250.255.255.239.in-addr.arpa.local. (52)
03:21:08.708305 IP6 DESKTOP-IHBR4H5.mdns > ff02::fb.mdns: 0 PTR (QM)? 250.255.255.239.in-addr.arpa.local. (52)
03:21:09.709221 IP DESKTOP-IHBR4H5.mdns > 224.0.0.251.mdns: 0 PTR (QM)? 250.255.255.239.in-addr.arpa.local. (52)
03:21:09.709926 IP6 DESKTOP-IHBR4H5.mdns > ff02::fb.mdns: 0 PTR (QM)? 250.255.255.239.in-addr.arpa.local. (52)
03:21:09.719489 IP DESKTOP-IHBR4H5.domain > 172.20.3.150.46166: 13616 NXDomain 0/1/0 (103)
03:21:09.721117 IP 172.20.3.150.57954 > DESKTOP-IHBR4H5.domain: 26866+ PTR? 1.0.20.172.in-addr.arpa. (41)
03:21:09.722301 IP DESKTOP-IHBR4H5.domain > 172.20.3.150.57954: 26866- 1/0/0 PTR DESKTOP-IHBR4H5. (93)
03:21:09.722335 IP DESKTOP-IHBR4H5.domain > 172.20.3.150.46166: 13616 NXDomain 0/1/0 (103)
03:21:09.723840 IP 172.20.3.150.49168 > DESKTOP-IHBR4H5.domain: 5042+ PTR? 150.3.20.172.in-addr.arpa. (43)
03:21:09.724790 IP 172.20.3.150 > DESKTOP-IHBR4H5: ICMP 172.20.3.150 udp port 46166 unreachable, length 139
03:21:09.737671 IP DESKTOP-IHBR4H5.mdns > 224.0.0.251.mdns: 0 PTR (QM)? 150.3.20.172.in-addr.arpa.local. (49)
03:21:09.738356 IP6 DESKTOP-IHBR4H5.mdns > ff02::fb.mdns: 0 PTR (QM)? 150.3.20.172.in-addr.arpa.local. (49)
03:21:10.745038 IP DESKTOP-IHBR4H5.mdns > 224.0.0.251.mdns: 0 PTR (QM)? 150.3.20.172.in-addr.arpa.local. (49)
03:21:10.745698 IP6 DESKTOP-IHBR4H5.mdns > ff02::fb.mdns: 0 PTR (QM)? 150.3.20.172.in-addr.arpa.local. (49)
03:21:10.750646 IP DESKTOP-IHBR4H5.domain > 172.20.3.150.49168: 5042 ServFail 0/0/0 (43)
03:21:10.751262 IP 172.20.3.150.38081 > DESKTOP-IHBR4H5.domain: 5042+ PTR? 150.3.20.172.in-addr.arpa. (43)
03:21:10.752260 IP DESKTOP-IHBR4H5.mdns > 224.0.0.251.mdns: 0 PTR (QM)? 150.3.20.172.in-addr.arpa.local. (49)
03:21:10.752792 IP DESKTOP-IHBR4H5.domain > 172.20.3.150.49168: 5042 NXDomain* 0/1/0 (93)
03:21:10.752812 IP6 DESKTOP-IHBR4H5.mdns > ff02::fb.mdns: 0 PTR (QM)? 150.3.20.172.in-addr.arpa.local. (49)
03:21:10.753597 IP 172.20.3.150 > DESKTOP-IHBR4H5: ICMP 172.20.3.150 udp port 49168 unreachable, length 129
03:21:11.701450 IP DESKTOP-IHBR4H5.51457 > 239.255.255.250.1900: UDP, length 101
03:21:11.765202 IP DESKTOP-IHBR4H5.mdns > 224.0.0.251.mdns: 0 PTR (QM)? 150.3.20.172.in-addr.arpa.local. (49)
03:21:11.765731 IP6 DESKTOP-IHBR4H5.mdns > ff02::fb.mdns: 0 PTR (QM)? 150.3.20.172.in-addr.arpa.local. (49)
03:21:11.770387 IP DESKTOP-IHBR4H5.domain > 172.20.3.150.38081: 5042 ServFail 0/0/0 (43)
03:21:11.771206 IP 172.20.3.150.43613 > DESKTOP-IHBR4H5.domain: 36079+ PTR? 251.0.0.224.in-addr.arpa. (42)
03:21:11.773895 IP DESKTOP-IHBR4H5.domain > 172.20.3.150.38081: 5042 NXDomain* 0/1/0 (93)
03:21:11.774079 IP 172.20.3.150 > DESKTOP-IHBR4H5: ICMP 172.20.3.150 udp port 38081 unreachable, length 129
03:21:11.794346 IP DESKTOP-IHBR4H5.mdns > 224.0.0.251.mdns: 0 PTR (QM)? 251.0.0.224.in-addr.arpa.local. (48)
03:21:11.794973 IP6 DESKTOP-IHBR4H5.mdns > ff02::fb.mdns: 0 PTR (QM)? 251.0.0.224.in-addr.arpa.local. (48)
03:21:12.725909 IP DESKTOP-IHBR4H5.domain > 172.20.3.150.46166: 13616 NXDomain 0/1/0 (103)
03:21:12.726015 IP 172.20.3.150 > DESKTOP-IHBR4H5: ICMP 172.20.3.150 udp port 46166 unreachable, length 139
03:21:12.727935 IP DESKTOP-IHBR4H5.domain > 172.20.3.150.46166: 13616 NXDomain 0/1/0 (103)
03:21:12.805492 IP 172.20.3.150.43206 > DESKTOP-IHBR4H5.domain: 33189+ PTR? b.f.0.0.0.0.0.0.0.0.0.0.0.0.0.0.0.0.0.0.0.0.0.0.0.0.0.0.2.0.f.f.ip6.arpa. (90)
03:21:13.823430 IP DESKTOP-IHBR4H5.domain > 172.20.3.150.43206: 33189 NXDomain 0/1/0 (154)
03:21:13.823542 IP 172.20.3.150 > DESKTOP-IHBR4H5: ICMP 172.20.3.150 udp port 43206 unreachable, length 190
03:21:14.475455 ARP, Request who-has 172.20.3.150 (00:15:5d:c1:25:a1 (oui Unknown)) tell DESKTOP-IHBR4H5, length 28
03:21:14.475477 ARP, Reply 172.20.3.150 is-at 00:15:5d:c1:25:a1 (oui Unknown), length 28
03:21:14.712551 IP DESKTOP-IHBR4H5.51457 > 239.255.255.250.1900: UDP, length 101
03:21:14.779118 IP DESKTOP-IHBR4H5.domain > 172.20.3.150.38081: 5042 ServFail 0/0/0 (43)
03:21:14.779196 IP 172.20.3.150 > DESKTOP-IHBR4H5: ICMP 172.20.3.150 udp port 38081 unreachable, length 79
03:21:14.782107 IP DESKTOP-IHBR4H5.domain > 172.20.3.150.38081: 5042 NXDomain* 0/1/0 (93)
03:21:14.782227 IP 172.20.3.150 > DESKTOP-IHBR4H5: ICMP 172.20.3.150 udp port 38081 unreachable, length 129
03:21:15.725856 IP DESKTOP-IHBR4H5.domain > 172.20.3.150.46166: 13616 NXDomain 0/1/0 (103)
03:21:15.819145 IP DESKTOP-IHBR4H5.domain > 172.20.3.150.43613: 36079 NXDomain 0/1/0 (99)
03:21:15.819223 IP 172.20.3.150 > DESKTOP-IHBR4H5: ICMP 172.20.3.150 udp port 43613 unreachable, length 135
03:21:15.822885 IP DESKTOP-IHBR4H5.domain > 172.20.3.150.43613: 36079 NXDomain 0/1/0 (99)
03:21:15.867515 IP DESKTOP-IHBR4H5.domain > 172.20.3.150.46166: 13616 NXDomain 0/1/0 (103)
03:21:16.765663 IP DESKTOP-IHBR4H5.domain > 172.20.3.150.49168: 5042 ServFail 0/0/0 (43)
03:21:16.767819 IP DESKTOP-IHBR4H5.domain > 172.20.3.150.49168: 5042 NXDomain* 0/1/0 (93)
03:21:16.767860 IP 172.20.3.150 > DESKTOP-IHBR4H5: ICMP 172.20.3.150 udp port 49168 unreachable, length 129
03:21:16.827883 IP DESKTOP-IHBR4H5.domain > 172.20.3.150.43206: 33189 NXDomain 0/1/0 (154)
03:21:16.830626 IP DESKTOP-IHBR4H5.domain > 172.20.3.150.43206: 33189 NXDomain 0/1/0 (154)
03:21:17.786658 IP DESKTOP-IHBR4H5.domain > 172.20.3.150.38081: 5042 ServFail 0/0/0 (43)
03:21:17.786737 IP 172.20.3.150 > DESKTOP-IHBR4H5: ICMP 172.20.3.150 udp port 38081 unreachable, length 79
03:21:17.788791 IP DESKTOP-IHBR4H5.domain > 172.20.3.150.38081: 5042 NXDomain* 0/1/0 (93)
03:21:18.730525 IP DESKTOP-IHBR4H5.domain > 172.20.3.150.46166: 13616 NXDomain 0/1/0 (103)
03:21:18.732866 IP DESKTOP-IHBR4H5.domain > 172.20.3.150.46166: 13616 NXDomain 0/1/0 (103)
03:21:18.756406 IP DESKTOP-IHBR4H5.51457 > 239.255.255.250.1900: UDP, length 101
03:21:18.824380 IP DESKTOP-IHBR4H5.domain > 172.20.3.150.43613: 36079 NXDomain 0/1/0 (99)
03:21:18.824455 IP 172.20.3.150 > DESKTOP-IHBR4H5: ICMP 172.20.3.150 udp port 43613 unreachable, length 135
03:21:18.829697 IP DESKTOP-IHBR4H5.domain > 172.20.3.150.43613: 36079 NXDomain 0/1/0 (99)
03:21:19.766559 IP DESKTOP-IHBR4H5.domain > 172.20.3.150.49168: 5042 ServFail 0/0/0 (43)
03:21:19.768815 IP DESKTOP-IHBR4H5.domain > 172.20.3.150.49168: 5042 NXDomain* 0/1/0 (93)
03:21:19.768890 IP 172.20.3.150 > DESKTOP-IHBR4H5: ICMP 172.20.3.150 udp port 49168 unreachable, length 129
03:21:19.828553 IP DESKTOP-IHBR4H5.domain > 172.20.3.150.43206: 33189 NXDomain 0/1/0 (154)
03:21:19.831049 IP DESKTOP-IHBR4H5.domain > 172.20.3.150.43206: 33189 NXDomain 0/1/0 (154)
03:21:20.795320 IP DESKTOP-IHBR4H5.domain > 172.20.3.150.38081: 5042 ServFail 0/0/0 (43)
03:21:20.795364 IP 172.20.3.150 > DESKTOP-IHBR4H5: ICMP 172.20.3.150 udp port 38081 unreachable, length 79
03:21:20.798024 IP DESKTOP-IHBR4H5.domain > 172.20.3.150.38081: 5042 NXDomain* 0/1/0 (93)
03:21:21.761633 IP DESKTOP-IHBR4H5.51457 > 239.255.255.250.1900: UDP, length 101
03:21:21.828198 IP DESKTOP-IHBR4H5.domain > 172.20.3.150.43613: 36079 NXDomain 0/1/0 (99)
03:21:21.828272 IP 172.20.3.150 > DESKTOP-IHBR4H5: ICMP 172.20.3.150 udp port 43613 unreachable, length 135
03:21:21.830740 IP DESKTOP-IHBR4H5.domain > 172.20.3.150.43613: 36079 NXDomain 0/1/0 (99)
03:21:22.832539 IP DESKTOP-IHBR4H5.domain > 172.20.3.150.43206: 33189 NXDomain 0/1/0 (154)
03:21:22.832982 IP 172.20.3.150 > DESKTOP-IHBR4H5: ICMP 172.20.3.150 udp port 43206 unreachable, length 190
03:21:22.834938 IP DESKTOP-IHBR4H5.domain > 172.20.3.150.43206: 33189 NXDomain 0/1/0 (154)
03:21:24.767633 IP DESKTOP-IHBR4H5.51457 > 239.255.255.250.1900: UDP, length 101
03:21:28.824606 IP DESKTOP-IHBR4H5.51457 > 239.255.255.250.1900: UDP, length 101
03:21:31.834235 IP DESKTOP-IHBR4H5.51457 > 239.255.255.250.1900: UDP, length 101
03:21:34.835276 IP DESKTOP-IHBR4H5.51457 > 239.255.255.250.1900: UDP, length 101
03:21:38.872388 IP DESKTOP-IHBR4H5.51457 > 239.255.255.250.1900: UDP, length 101
03:21:41.679008 IP DESKTOP-IHBR4H5.63939 > 239.255.255.250.1900: UDP, length 173
03:21:41.887488 IP DESKTOP-IHBR4H5.51457 > 239.255.255.250.1900: UDP, length 101
03:21:42.681094 IP DESKTOP-IHBR4H5.63939 > 239.255.255.250.1900: UDP, length 173
03:21:43.681788 IP DESKTOP-IHBR4H5.63939 > 239.255.255.250.1900: UDP, length 173
03:21:44.682603 IP DESKTOP-IHBR4H5.63939 > 239.255.255.250.1900: UDP, length 173
03:21:44.898037 IP DESKTOP-IHBR4H5.51457 > 239.255.255.250.1900: UDP, length 101
03:21:48.937134 IP DESKTOP-IHBR4H5.51457 > 239.255.255.250.1900: UDP, length 101
^C
90 packets captured
109 packets received by filter
19 packets dropped by kernel