afafa82@DESKTOP-IHBR4H5:~$ sudo tcpdump -n -i eth0
tcpdump: verbose output suppressed, use -v or -vv for full protocol decode
listening on eth0, link-type EN10MB (Ethernet), capture size 262144 bytes
03:30:01.827705 IP 172.20.0.1.51457 > 239.255.255.250.1900: UDP, length 101
03:30:04.831496 IP 172.20.0.1.51457 > 239.255.255.250.1900: UDP, length 101
03:30:07.834081 IP 172.20.0.1.51457 > 239.255.255.250.1900: UDP, length 101
03:30:11.874831 IP 172.20.0.1.51457 > 239.255.255.250.1900: UDP, length 101
03:30:14.885299 IP 172.20.0.1.51457 > 239.255.255.250.1900: UDP, length 101
03:30:17.896733 IP 172.20.0.1.51457 > 239.255.255.250.1900: UDP, length 101