afafa82@DESKTOP-IHBR4H5:~$ sudo tcpdump -A -i eth0
tcpdump: verbose output suppressed, use -v or -vv for full protocol decode
listening on eth0, link-type EN10MB (Ethernet), capture size 262144 bytes
03:24:29.866314 IP DESKTOP-IHBR4H5.51457 > 239.255.255.250.1900: UDP, length 101
E...*......=...........l.m.|M-SEARCH * HTTP/1.1
Host: 239.255.255.250:1900
ST: upnp:rootdevice
Man: "ssdp:discover"
MX: 3


03:24:29.867997 IP 172.20.3.150.47662 > DESKTOP-IHBR4H5.domain: 11187+ PTR? 250.255.255.239.in-addr.arpa. (46)
E..J.4@.@.=............5.6\.+............250.255.255.239.in-addr.arpa.....
03:24:29.876329 IP DESKTOP-IHBR4H5.mdns > 224.0.0.251.mdns: 0 PTR (QM)? 250.255.255.239.in-addr.arpa.local. (52)
E..P.....................<...............250.255.255.239.in-addr.arpa.local.....
03:24:29.877042 IP6 DESKTOP-IHBR4H5.mdns > ff02::fb.mdns: 0 PTR (QM)? 250.255.255.239.in-addr.arpa.local. (52)
`..J.<.............D.#.!.....................<<..............250.255.255.239.in-addr.arpa.local.....
03:24:30.881240 IP DESKTOP-IHBR4H5.mdns > 224.0.0.251.mdns: 0 PTR (QM)? 250.255.255.239.in-addr.arpa.local. (52)
E..P.....................<...............250.255.255.239.in-addr.arpa.local.....
03:24:30.881761 IP6 DESKTOP-IHBR4H5.mdns > ff02::fb.mdns: 0 PTR (QM)? 250.255.255.239.in-addr.arpa.local. (52)
`..J.<.............D.#.!.....................<<..............250.255.255.239.in-addr.arpa.local.....
03:24:30.886832 IP DESKTOP-IHBR4H5.domain > 172.20.3.150.47662: 11187 NXDomain 0/1/0 (103)
E...%......!.........5...oW.+............250.255.255.239.in-addr.arpa.............
8.-.sns.dns.icann.org..noc.>xw..... .....       :.....
03:24:30.887025 IP 172.20.3.150.32957 > DESKTOP-IHBR4H5.domain: 30371+ PTR? 1.0.20.172.in-addr.arpa. (41)
E..E.p@.@.=x...........5.1\.v............1.0.20.172.in-addr.arpa.....
03:24:30.887822 IP DESKTOP-IHBR4H5.domain > 172.20.3.150.32957: 30371- 1/0/0 PTR DESKTOP-IHBR4H5. (93)
E..y%......*.........5...ef.v............1.0.20.172.in-addr.arpa......1.0.20.172.in-addr.arpa............DESKTOP-IHBR4H5.
03:24:30.888082 IP 172.20.3.150.55658 > DESKTOP-IHBR4H5.domain: 30434+ PTR? 150.3.20.172.in-addr.arpa. (43)
E..G.q@.@.=u.........j.5.3\.v............150.3.20.172.in-addr.arpa.....
03:24:30.889128 IP DESKTOP-IHBR4H5.domain > 172.20.3.150.47662: 11187 NXDomain 0/1/0 (103)
E...%................5...o[.+............250.255.255.239.in-addr.arpa................-.sns.dns.icann.org..noc.>xw..... .....    :.....
03:24:30.889170 IP 172.20.3.150 > DESKTOP-IHBR4H5: ICMP 172.20.3.150 udp port 47662 unreachable, length 139
E.......@..@..........Y=....E...%................5...o[.+............250.255.255.239.in-addr.arpa................-.sns.dns.icann.org..noc.>xw..... .....        :.....
03:24:30.903577 IP DESKTOP-IHBR4H5.mdns > 224.0.0.251.mdns: 0 PTR (QM)? 150.3.20.172.in-addr.arpa.local. (49)
E..M.....................9WH.............150.3.20.172.in-addr.arpa.local.....
03:24:30.904028 IP6 DESKTOP-IHBR4H5.mdns > ff02::fb.mdns: 0 PTR (QM)? 150.3.20.172.in-addr.arpa.local. (49)
`..J.9.............D.#.!.....................9y..............150.3.20.172.in-addr.arpa.local.....
03:24:31.912816 IP DESKTOP-IHBR4H5.mdns > 224.0.0.251.mdns: 0 PTR (QM)? 150.3.20.172.in-addr.arpa.local. (49)
E..M.....................9WH.............150.3.20.172.in-addr.arpa.local.....
03:24:31.913536 IP6 DESKTOP-IHBR4H5.mdns > ff02::fb.mdns: 0 PTR (QM)? 150.3.20.172.in-addr.arpa.local. (49)
`.Q..9.............D.#.!.....................9y..............150.3.20.172.in-addr.arpa.local.....
03:24:31.922238 IP DESKTOP-IHBR4H5.domain > 172.20.3.150.55658: 30434 ServFail 0/0/0 (43)
E..G%......Z.........5.j.3..v............150.3.20.172.in-addr.arpa.....
03:24:31.922239 IP DESKTOP-IHBR4H5.domain > 172.20.3.150.55658: 30434 NXDomain* 0/1/0 (93)
E..y%......'.........5.j.e.Xv............150.3.20.172.in-addr.arpa.............Q..&     localhost..root.7w.%...p...8@.6....Q.
03:24:31.922533 IP 172.20.3.150.40049 > DESKTOP-IHBR4H5.domain: 30434+ PTR? 150.3.20.172.in-addr.arpa. (43)
E..G..@.@.=@.........q.5.3\.v............150.3.20.172.in-addr.arpa.....
03:24:31.937130 IP DESKTOP-IHBR4H5.mdns > 224.0.0.251.mdns: 0 PTR (QM)? 150.3.20.172.in-addr.arpa.local. (49)
E..M.....................9WH.............150.3.20.172.in-addr.arpa.local.....
03:24:31.937679 IP6 DESKTOP-IHBR4H5.mdns > ff02::fb.mdns: 0 PTR (QM)? 150.3.20.172.in-addr.arpa.local. (49)
`.Q..9.............D.#.!.....................9y..............150.3.20.172.in-addr.arpa.local.....
03:24:32.872647 IP DESKTOP-IHBR4H5.51457 > 239.255.255.250.1900: UDP, length 101
E...* .....<...........l.m.|M-SEARCH * HTTP/1.1
Host: 239.255.255.250:1900
ST: upnp:rootdevice
Man: "ssdp:discover"
MX: 3


03:24:32.951339 IP DESKTOP-IHBR4H5.mdns > 224.0.0.251.mdns: 0 PTR (QM)? 150.3.20.172.in-addr.arpa.local. (49)
E..M.....................9WH.............150.3.20.172.in-addr.arpa.local.....
03:24:32.951957 IP6 DESKTOP-IHBR4H5.mdns > ff02::fb.mdns: 0 PTR (QM)? 150.3.20.172.in-addr.arpa.local. (49)
`.Q..9.............D.#.!.....................9y..............150.3.20.172.in-addr.arpa.local.....
03:24:32.957499 IP DESKTOP-IHBR4H5.domain > 172.20.3.150.40049: 30434 ServFail 0/0/0 (43)
E..G%......X.........5.q.3..v............150.3.20.172.in-addr.arpa.....
03:24:32.957957 IP 172.20.3.150.39838 > DESKTOP-IHBR4H5.domain: 40519+ PTR? 251.0.0.224.in-addr.arpa. (42)
E..F..@.@.=7...........5.2\..G...........251.0.0.224.in-addr.arpa.....
03:24:32.959886 IP DESKTOP-IHBR4H5.domain > 172.20.3.150.40049: 30434 NXDomain* 0/1/0 (93)
E..y%......%.........5.q.e.Rv............150.3.20.172.in-addr.arpa.............Q..&     localhost..root.7w.%...p...8@.6....Q.
03:24:32.959955 IP 172.20.3.150 > DESKTOP-IHBR4H5: ICMP 172.20.3.150 udp port 40049 unreachable, length 129
E....@..@.-...........Y3....E..y%......%.........5.q.e.Rv............150.3.20.172.in-addr.arpa.............Q..& localhost..root.7w.%...p...8@.6....Q.
03:24:32.963491 IP DESKTOP-IHBR4H5.mdns > 224.0.0.251.mdns: 0 PTR (QM)? 251.0.0.224.in-addr.arpa.local. (48)
E..L.....................8.N.............251.0.0.224.in-addr.arpa.local.....
03:24:32.963892 IP6 DESKTOP-IHBR4H5.mdns > ff02::fb.mdns: 0 PTR (QM)? 251.0.0.224.in-addr.arpa.local. (48)
`.Q..8.............D.#.!.....................8...............251.0.0.224.in-addr.arpa.local.....
03:24:33.890986 IP DESKTOP-IHBR4H5.domain > 172.20.3.150.47662: 11187 NXDomain 0/1/0 (103)
E...%................5...o[A+............250.255.255.239.in-addr.arpa................-.sns.dns.icann.org..noc.>xw..... .....    :.....
03:24:33.891006 IP 172.20.3.150 > DESKTOP-IHBR4H5: ICMP 172.20.3.150 udp port 47662 unreachable, length 139
E.......@.-W..........Y=....E...%................5...o[A+............250.255.255.239.in-addr.arpa................-.sns.dns.icann.org..noc.>xw..... .....        :.....
03:24:33.893432 IP DESKTOP-IHBR4H5.domain > 172.20.3.150.47662: 11187 NXDomain 0/1/0 (103)
E...%................5...oW@+............250.255.255.239.in-addr.arpa.............
..-.sns.dns.icann.org..noc.>xw..... .....       :.....
03:24:33.893452 IP 172.20.3.150 > DESKTOP-IHBR4H5: ICMP 172.20.3.150 udp port 47662 unreachable, length 139
E.......@.-V..........Y=....E...%................5...oW@+............250.255.255.239.in-addr.arpa.............
..-.sns.dns.icann.org..noc.>xw..... .....       :.....
03:24:33.971191 IP 172.20.3.150.40144 > DESKTOP-IHBR4H5.domain: 13080+ PTR? b.f.0.0.0.0.0.0.0.0.0.0.0.0.0.0.0.0.0.0.0.0.0.0.0.0.0.0.2.0.f.f.ip6.arpa. (90)
E..v..@.@.<............5.b\33............b.f.0.0.0.0.0.0.0.0.0.0.0.0.0.0.0.0.0.0.0.0.0.0.0.0.0.0.2.0.f.f.ip6.arpa.....
03:24:34.998609 IP DESKTOP-IHBR4H5.domain > 172.20.3.150.40144: 13080 NXDomain 0/1/0 (154)
E...%................5....]K3............b.f.0.0.0.0.0.0.0.0.0.0.0.0.0.0.0.0.0.0.0.0.0.0.0.0.0.0.2.0.f.f.ip6.arpa......L.........4.b.ip6-servers.P.nstld.iana.org.xw........... :.....
03:24:34.999104 IP 172.20.3.150 > DESKTOP-IHBR4H5: ICMP 172.20.3.150 udp port 40144 unreachable, length 190
E.......@.,...........Yp....E...%................5....]K3............b.f.0.0.0.0.0.0.0.0.0.0.0.0.0.0.0.0.0.0.0.0.0.0.0.0.0.0.2.0.f.f.ip6.arpa......L.........4.b.ip6-servers.P.nstld.iana.org.xw...........     :.....
03:24:35.474996 ARP, Request who-has 172.20.3.150 (00:15:5d:c1:25:a1 (oui Unknown)) tell DESKTOP-IHBR4H5, length 28
..........]o........].%.....
03:24:35.475074 ARP, Reply 172.20.3.150 is-at 00:15:5d:c1:25:a1 (oui Unknown), length 28
..........].%.......]o......
03:24:35.884361 IP DESKTOP-IHBR4H5.51457 > 239.255.255.250.1900: UDP, length 101
E...*!.....;...........l.m.|M-SEARCH * HTTP/1.1
Host: 239.255.255.250:1900
ST: upnp:rootdevice
Man: "ssdp:discover"
MX: 3


03:24:35.966826 IP DESKTOP-IHBR4H5.domain > 172.20.3.150.40049: 30434 ServFail 0/0/0 (43)
E..G%......M.........5.q.3..v............150.3.20.172.in-addr.arpa.....
03:24:35.966883 IP 172.20.3.150 > DESKTOP-IHBR4H5: ICMP 172.20.3.150 udp port 40049 unreachable, length 79
E..c....@.-/..........Y.....E..G%......M.........5.q.3..v............150.3.20.172.in-addr.arpa.....
03:24:35.969048 IP DESKTOP-IHBR4H5.domain > 172.20.3.150.40049: 30434 NXDomain* 0/1/0 (93)
E..y%................5.q.e.Rv............150.3.20.172.in-addr.arpa.............Q..&     localhost..root.7w.%...p...8@.6....Q.
03:24:35.969141 IP 172.20.3.150 > DESKTOP-IHBR4H5: ICMP 172.20.3.150 udp port 40049 unreachable, length 129
E.......@.,...........Y3....E..y%................5.q.e.Rv............150.3.20.172.in-addr.arpa.............Q..& localhost..root.7w.%...p...8@.6....Q.
03:24:36.898791 IP DESKTOP-IHBR4H5.domain > 172.20.3.150.47662: 11187 NXDomain 0/1/0 (103)
E...%................5...o[D+............250.255.255.239.in-addr.arpa................-.sns.dns.icann.org..noc.>xw..... .....    :.....
03:24:36.900830 IP DESKTOP-IHBR4H5.domain > 172.20.3.150.47662: 11187 NXDomain 0/1/0 (103)
E...%................5...oU.+............250.255.255.239.in-addr.arpa................-.sns.dns.icann.org..noc.>xw..... .....    :.....
03:24:36.979673 IP DESKTOP-IHBR4H5.domain > 172.20.3.150.39838: 40519 NXDomain 0/1/0 (99)
E...%................5...k.2.G...........251.0.0.224.in-addr.arpa..............$.-.sns.dns.icann.org..noc.:xw..... .....:.....
03:24:36.979719 IP 172.20.3.150 > DESKTOP-IHBR4H5: ICMP 172.20.3.150 udp port 39838 unreachable, length 135
E....$..@.,...........Y9....E...%................5...k.2.G...........251.0.0.224.in-addr.arpa..............$.-.sns.dns.icann.org..noc.:xw..... .....    :.....
03:24:36.982383 IP DESKTOP-IHBR4H5.domain > 172.20.3.150.39838: 40519 NXDomain 0/1/0 (99)
E...%................5...k...G...........251.0.0.224.in-addr.arpa.............  O.-.sns.dns.icann.org..noc.:xw..... .....       :.....
03:24:37.938404 IP DESKTOP-IHBR4H5.domain > 172.20.3.150.55658: 30434 ServFail 0/0/0 (43)
E..G%......G.........5.j.3..v............150.3.20.172.in-addr.arpa.....
03:24:37.946983 IP DESKTOP-IHBR4H5.domain > 172.20.3.150.55658: 30434 NXDomain* 0/1/0 (93)
E..y%................5.j.e.Xv............150.3.20.172.in-addr.arpa.............Q..&     localhost..root.7w.%...p...8@.6....Q.
03:24:38.002689 IP DESKTOP-IHBR4H5.domain > 172.20.3.150.40144: 13080 NXDomain 0/1/0 (154)
E...%................5....V.3............b.f.0.0.0.0.0.0.0.0.0.0.0.0.0.0.0.0.0.0.0.0.0.0.0.0.0.0.2.0.f.f.ip6.arpa......L.......u.4.b.ip6-servers.P.nstld.iana.org.xw........... :.....
03:24:38.002889 IP 172.20.3.150 > DESKTOP-IHBR4H5: ICMP 172.20.3.150 udp port 40144 unreachable, length 190
E....V..@.,U..........Yp....E...%................5....V.3............b.f.0.0.0.0.0.0.0.0.0.0.0.0.0.0.0.0.0.0.0.0.0.0.0.0.0.0.2.0.f.f.ip6.arpa......L.......u.4.b.ip6-servers.P.nstld.iana.org.xw...........     :.....
03:24:38.005039 IP DESKTOP-IHBR4H5.domain > 172.20.3.150.40144: 13080 NXDomain 0/1/0 (154)
E...%................5....V-3............b.f.0.0.0.0.0.0.0.0.0.0.0.0.0.0.0.0.0.0.0.0.0.0.0.0.0.0.2.0.f.f.ip6.arpa......L.........4.b.ip6-servers.P.nstld.iana.org.xw........... :.....
03:24:38.974752 IP DESKTOP-IHBR4H5.domain > 172.20.3.150.40049: 30434 ServFail 0/0/0 (43)
E..G%......C.........5.q.3..v............150.3.20.172.in-addr.arpa.....
03:24:38.974781 IP 172.20.3.150 > DESKTOP-IHBR4H5: ICMP 172.20.3.150 udp port 40049 unreachable, length 79
E..c....@.,{..........Y.....E..G%......C.........5.q.3..v............150.3.20.172.in-addr.arpa.....
03:24:38.977123 IP DESKTOP-IHBR4H5.domain > 172.20.3.150.40049: 30434 NXDomain* 0/1/0 (93)
E..y%................5.q.e.Rv............150.3.20.172.in-addr.arpa.............Q..&     localhost..root.7w.%...p...8@.6....Q.
03:24:39.903236 IP DESKTOP-IHBR4H5.domain > 172.20.3.150.47662: 11187 NXDomain 0/1/0 (103)
E...%................5...oZj+............250.255.255.239.in-addr.arpa..............r.-.sns.dns.icann.org..noc.>xw..... .....    :.....
03:24:39.905555 IP DESKTOP-IHBR4H5.domain > 172.20.3.150.47662: 11187 NXDomain 0/1/0 (103)
E...%................5...oWF+............250.255.255.239.in-addr.arpa.............
..-.sns.dns.icann.org..noc.>xw..... .....       :.....
03:24:39.929594 IP DESKTOP-IHBR4H5.51457 > 239.255.255.250.1900: UDP, length 101
E...*".....:...........l.m.|M-SEARCH * HTTP/1.1
Host: 239.255.255.250:1900
ST: upnp:rootdevice
Man: "ssdp:discover"
MX: 3


03:24:39.980362 IP DESKTOP-IHBR4H5.domain > 172.20.3.150.39838: 40519 NXDomain 0/1/0 (99)
E...%................5...k...G...........251.0.0.224.in-addr.arpa................-.sns.dns.icann.org..noc.:xw..... .....:.....
03:24:39.980408 IP 172.20.3.150 > DESKTOP-IHBR4H5: ICMP 172.20.3.150 udp port 39838 unreachable, length 135
E.......@.,...........Y9....E...%................5...k...G...........251.0.0.224.in-addr.arpa................-.sns.dns.icann.org..noc.:xw..... .....    :.....
03:24:40.119505 IP DESKTOP-IHBR4H5.domain > 172.20.3.150.39838: 40519 NXDomain 0/1/0 (99)
E...%................5...k.F.G...........251.0.0.224.in-addr.arpa................-.sns.dns.icann.org..noc.:xw..... .....:.....
03:24:40.960240 IP DESKTOP-IHBR4H5.domain > 172.20.3.150.55658: 30434 ServFail 0/0/0 (43)
E..G%......=.........5.j.3..v............150.3.20.172.in-addr.arpa.....
03:24:40.960287 IP 172.20.3.150 > DESKTOP-IHBR4H5: ICMP 172.20.3.150 udp port 55658 unreachable, length 79
E..c.   ..@.,...........Y.....E..G%......=.........5.j.3..v............150.3.20.172.in-addr.arpa.....
03:24:40.961054 IP DESKTOP-IHBR4H5.domain > 172.20.3.150.55658: 30434 NXDomain* 0/1/0 (93)
E..y%......
.........5.j.e.Xv............150.3.20.172.in-addr.arpa.............Q..& localhost..root.7w.%...p...8@.6....Q.
03:24:41.015801 IP DESKTOP-IHBR4H5.domain > 172.20.3.150.40144: 13080 NXDomain 0/1/0 (154)
E...%................5....U.3............b.f.0.0.0.0.0.0.0.0.0.0.0.0.0.0.0.0.0.0.0.0.0.0.0.0.0.0.2.0.f.f.ip6.arpa......L......  ..4.b.ip6-servers.P.nstld.iana.org.xw...........        :.....
03:24:41.019010 IP DESKTOP-IHBR4H5.domain > 172.20.3.150.40144: 13080 NXDomain 0/1/0 (154)
E...%................5....]Q3............b.f.0.0.0.0.0.0.0.0.0.0.0.0.0.0.0.0.0.0.0.0.0.0.0.0.0.0.2.0.f.f.ip6.arpa......L.........4.b.ip6-servers.P.nstld.iana.org.xw........... :.....
03:24:41.983941 IP DESKTOP-IHBR4H5.domain > 172.20.3.150.40049: 30434 ServFail 0/0/0 (43)
E..G%......9.........5.q.3..v............150.3.20.172.in-addr.arpa.....
03:24:41.983966 IP 172.20.3.150 > DESKTOP-IHBR4H5: ICMP 172.20.3.150 udp port 40049 unreachable, length 79
E..c.k..@.+...........Y.....E..G%......9.........5.q.3..v............150.3.20.172.in-addr.arpa.....
03:24:41.986286 IP DESKTOP-IHBR4H5.domain > 172.20.3.150.40049: 30434 NXDomain* 0/1/0 (93)
E..y%................5.q.e.Rv............150.3.20.172.in-addr.arpa.............Q..&     localhost..root.7w.%...p...8@.6....Q.
03:24:42.931614 IP DESKTOP-IHBR4H5.51457 > 239.255.255.250.1900: UDP, length 101
E...*#.....9...........l.m.|M-SEARCH * HTTP/1.1
Host: 239.255.255.250:1900
ST: upnp:rootdevice
Man: "ssdp:discover"
MX: 3


03:24:42.981787 IP DESKTOP-IHBR4H5.domain > 172.20.3.150.39838: 40519 NXDomain 0/1/0 (99)
E...%................5...k...G...........251.0.0.224.in-addr.arpa................-.sns.dns.icann.org..noc.:xw..... .....:.....
03:24:42.981833 IP 172.20.3.150 > DESKTOP-IHBR4H5: ICMP 172.20.3.150 udp port 39838 unreachable, length 135
E.......@.+A..........Y9....E...%................5...k...G...........251.0.0.224.in-addr.arpa................-.sns.dns.icann.org..noc.:xw..... .....    :.....
03:24:42.984019 IP DESKTOP-IHBR4H5.domain > 172.20.3.150.39838: 40519 NXDomain 0/1/0 (99)
E...%................5...k...G...........251.0.0.224.in-addr.arpa................-.sns.dns.icann.org..noc.:xw..... .....:.....
03:24:44.020892 IP DESKTOP-IHBR4H5.domain > 172.20.3.150.40144: 13080 NXDomain 0/1/0 (154)
E...%................5....X.3............b.f.0.0.0.0.0.0.0.0.0.0.0.0.0.0.0.0.0.0.0.0.0.0.0.0.0.0.2.0.f.f.ip6.arpa......L.........4.b.ip6-servers.P.nstld.iana.org.xw........... :.....
03:24:44.035766 IP 172.20.3.150 > DESKTOP-IHBR4H5: ICMP 172.20.3.150 udp port 40144 unreachable, length 190
E.......@.*...........Yp....E...%................5....X.3............b.f.0.0.0.0.0.0.0.0.0.0.0.0.0.0.0.0.0.0.0.0.0.0.0.0.0.0.2.0.f.f.ip6.arpa......L.........4.b.ip6-servers.P.nstld.iana.org.xw...........     :.....
03:24:44.035836 IP DESKTOP-IHBR4H5.domain > 172.20.3.150.40144: 13080 NXDomain 0/1/0 (154)
E...%................5....^.3............b.f.0.0.0.0.0.0.0.0.0.0.0.0.0.0.0.0.0.0.0.0.0.0.0.0.0.0.2.0.f.f.ip6.arpa......L......._.4.b.ip6-servers.P.nstld.iana.org.xw........... :.....
03:24:45.932698 IP DESKTOP-IHBR4H5.51457 > 239.255.255.250.1900: UDP, length 101
E...*$.....8...........l.m.|M-SEARCH * HTTP/1.1
Host: 239.255.255.250:1900
ST: upnp:rootdevice
Man: "ssdp:discover"
MX: 3


03:24:49.978560 IP DESKTOP-IHBR4H5.51457 > 239.255.255.250.1900: UDP, length 101
E...*%.....7...........l.m.|M-SEARCH * HTTP/1.1
Host: 239.255.255.250:1900
ST: upnp:rootdevice
Man: "ssdp:discover"
MX: 3


03:24:52.988466 IP DESKTOP-IHBR4H5.51457 > 239.255.255.250.1900: UDP, length 101
E...*&.....6...........l.m.|M-SEARCH * HTTP/1.1
Host: 239.255.255.250:1900
ST: upnp:rootdevice
Man: "ssdp:discover"
MX: 3


03:24:55.999471 IP DESKTOP-IHBR4H5.51457 > 239.255.255.250.1900: UDP, length 101
E...*'.....5...........l.m.|M-SEARCH * HTTP/1.1
Host: 239.255.255.250:1900
ST: upnp:rootdevice
Man: "ssdp:discover"
MX: 3


03:25:00.046532 IP DESKTOP-IHBR4H5.51457 > 239.255.255.250.1900: UDP, length 101
E...*(.....4...........l.m.|M-SEARCH * HTTP/1.1
Host: 239.255.255.250:1900
ST: upnp:rootdevice
Man: "ssdp:discover"
MX: 3


03:25:03.052795 IP DESKTOP-IHBR4H5.51457 > 239.255.255.250.1900: UDP, length 101
E...*).....3...........l.m.|M-SEARCH * HTTP/1.1
Host: 239.255.255.250:1900
ST: upnp:rootdevice
Man: "ssdp:discover"
MX: 3


03:25:06.065492 IP DESKTOP-IHBR4H5.51457 > 239.255.255.250.1900: UDP, length 101
E...**.....2...........l.m.|M-SEARCH * HTTP/1.1
Host: 239.255.255.250:1900
ST: upnp:rootdevice
Man: "ssdp:discover"
MX: 3


03:25:10.111362 IP DESKTOP-IHBR4H5.51457 > 239.255.255.250.1900: UDP, length 101
E...*+.....1...........l.m.|M-SEARCH * HTTP/1.1
Host: 239.255.255.250:1900
ST: upnp:rootdevice
Man: "ssdp:discover"
MX: 3


^C
86 packets captured
104 packets received by filter
18 packets dropped by kernel