afafa82@DESKTOP-IHBR4H5:~$ sudo tcpdump -r 0001.pcap
reading from file 0001.pcap, link-type EN10MB (Ethernet)
03:28:11.227505 IP DESKTOP-IHBR4H5.51457 > 239.255.255.250.1900: UDP, length 101
03:28:14.242572 IP DESKTOP-IHBR4H5.51457 > 239.255.255.250.1900: UDP, length 101
03:28:17.244458 IP DESKTOP-IHBR4H5.51457 > 239.255.255.250.1900: UDP, length 101
03:28:21.296673 IP DESKTOP-IHBR4H5.51457 > 239.255.255.250.1900: UDP, length 101
03:28:24.307950 IP DESKTOP-IHBR4H5.51457 > 239.255.255.250.1900: UDP, length 101
03:28:27.309425 IP DESKTOP-IHBR4H5.51457 > 239.255.255.250.1900: UDP, length 101
03:28:31.337914 IP DESKTOP-IHBR4H5.51457 > 239.255.255.250.1900: UDP, length 101
03:28:34.344564 IP DESKTOP-IHBR4H5.51457 > 239.255.255.250.1900: UDP, length 101
03:28:37.350189 IP DESKTOP-IHBR4H5.51457 > 239.255.255.250.1900: UDP, length 101
03:28:41.401496 IP DESKTOP-IHBR4H5.51457 > 239.255.255.250.1900: UDP, length 101
03:28:42.010742 IP DESKTOP-IHBR4H5.netbios-ns > 172.20.15.255.netbios-ns: UDP, length 50
03:28:42.011154 IP DESKTOP-IHBR4H5.mdns > 224.0.0.251.mdns: 0 A (QM)? 1DEB45000000.local. (36)
03:28:42.011645 IP6 DESKTOP-IHBR4H5.mdns > ff02::fb.mdns: 0 A (QM)? 1DEB45000000.local. (36)
03:28:42.012419 IP DESKTOP-IHBR4H5.mdns > 224.0.0.251.mdns: 0 AAAA (QM)? 1DEB45000000.local. (36)
03:28:42.012856 IP6 DESKTOP-IHBR4H5.mdns > ff02::fb.mdns: 0 AAAA (QM)? 1DEB45000000.local. (36)
03:28:42.772883 IP DESKTOP-IHBR4H5.netbios-ns > 172.20.15.255.netbios-ns: UDP, length 50
03:28:43.023050 IP DESKTOP-IHBR4H5.mdns > 224.0.0.251.mdns: 0 A (QM)? 1DEB45000000.local. (36)
03:28:43.023482 IP DESKTOP-IHBR4H5.netbios-ns > 172.20.15.255.netbios-ns: UDP, length 50
03:28:43.023564 IP6 DESKTOP-IHBR4H5.mdns > ff02::fb.mdns: 0 A (QM)? 1DEB45000000.local. (36)
03:28:43.024387 IP DESKTOP-IHBR4H5.mdns > 224.0.0.251.mdns: 0 AAAA (QM)? 1DEB45000000.local. (36)
03:28:43.024722 IP6 DESKTOP-IHBR4H5.mdns > ff02::fb.mdns: 0 AAAA (QM)? 1DEB45000000.local. (36)
03:28:43.025435 IP DESKTOP-IHBR4H5.mdns > 224.0.0.251.mdns: 0 A (QM)? 1DEB45000000.local. (36)
03:28:43.025924 IP6 DESKTOP-IHBR4H5.mdns > ff02::fb.mdns: 0 A (QM)? 1DEB45000000.local. (36)
03:28:43.026590 IP DESKTOP-IHBR4H5.mdns > 224.0.0.251.mdns: 0 AAAA (QM)? 1DEB45000000.local. (36)
03:28:43.027060 IP6 DESKTOP-IHBR4H5.mdns > ff02::fb.mdns: 0 AAAA (QM)? 1DEB45000000.local. (36)
03:28:43.524130 IP DESKTOP-IHBR4H5.netbios-ns > 172.20.15.255.netbios-ns: UDP, length 50
03:28:43.774464 IP DESKTOP-IHBR4H5.netbios-ns > 172.20.15.255.netbios-ns: UDP, length 50
03:28:44.026686 IP DESKTOP-IHBR4H5.mdns > 224.0.0.251.mdns: 0 A (QM)? 1DEB45000000.local. (36)
03:28:44.027449 IP6 DESKTOP-IHBR4H5.mdns > ff02::fb.mdns: 0 A (QM)? 1DEB45000000.local. (36)
03:28:44.041693 IP DESKTOP-IHBR4H5.mdns > 224.0.0.251.mdns: 0 AAAA (QM)? 1DEB45000000.local. (36)
03:28:44.042171 IP6 DESKTOP-IHBR4H5.mdns > ff02::fb.mdns: 0 AAAA (QM)? 1DEB45000000.local. (36)
03:28:44.278881 IP DESKTOP-IHBR4H5.netbios-ns > 172.20.15.255.netbios-ns: UDP, length 50
03:28:44.279536 IP DESKTOP-IHBR4H5.mdns > 224.0.0.251.mdns: 0 A (QM)? 1DEB45000000.local. (36)
tcpdump: pcap_loop: truncated dump file; tried to read 98 captured bytes, only got 60